{
  "$schema": "../../spec/v1/schemas/installed-state.schema.json",
  "apiVersion": "ops.company/v1",
  "manifestKind": "InstalledState",
  "metadata": {
    "projectId": "sample-system",
    "environment": "production",
    "hostId": "WIN-OPS-01",
    "generation": 3,
    "observedAt": "2026-08-11T08:05:00Z"
  },
  "release": {
    "version": "1.0.0",
    "releaseManifestSha256": "dddddddddddddddddddddddddddddddddddddddddddddddddddddddddddddddd",
    "currentPath": "C:\\CompanyOps\\Apps\\sample-system\\releases\\1.0.0",
    "previousVersion": "0.9.0",
    "previousPath": "C:\\CompanyOps\\Apps\\sample-system\\releases\\0.9.0",
    "installedAt": "2026-08-11T08:03:00Z"
  },
  "components": [
    {
      "componentId": "api",
      "kind": "windowsService",
      "adapter": "scm",
      "nativeId": "Company.SampleSystem.Api",
      "runtimeState": "running",
      "healthState": "healthy",
      "probedAt": "2026-08-11T08:05:00Z",
      "healthDetail": "HTTP 200，status=ok"
    },
    {
      "componentId": "web",
      "kind": "staticSite",
      "adapter": "iis",
      "nativeId": "Company.SampleSystem.Web",
      "runtimeState": "running",
      "healthState": "healthy",
      "probedAt": "2026-08-11T08:05:00Z"
    },
    {
      "componentId": "cleanup",
      "kind": "scheduledTask",
      "adapter": "taskScheduler",
      "nativeId": "\\CompanyOps\\SampleSystem\\Cleanup",
      "runtimeState": "stopped",
      "healthState": "notConfigured"
    },
    {
      "componentId": "legacy-worker",
      "kind": "pm2Legacy",
      "adapter": "pm2Legacy",
      "nativeId": "pm_id:7",
      "runtimeState": "running",
      "healthState": "healthy",
      "probedAt": "2026-08-11T08:04:58Z"
    }
  ],
  "lastOperation": {
    "operationId": "op-20260811-0001",
    "action": "install",
    "status": "succeeded",
    "startedAt": "2026-08-11T08:00:00Z",
    "completedAt": "2026-08-11T08:03:00Z",
    "message": "制品校验、资源登记和健康复核全部通过。"
  }
}
